{
  "meta": {
    "version": "1.0",
    "seed": 12345,
    "map_size": 100,
    "unit_scale": 4
  },
  "nodes": [
    {
      "id": 1,
      "x": 10,
      "y": 20
    },
    {
      "id": 2,
      "x": 40,
      "y": 22
    },
    {
      "id": 3,
      "x": 70,
      "y": 25
    },
    {
      "id": 4,
      "x": 42,
      "y": 40
    }
  ],
  "edges": [
    {
      "id": 1,
      "a": 1,
      "b": 2,
      "class": "Roman",
      "length": 31.0,
      "crossing_id": null
    },
    {
      "id": 2,
      "a": 2,
      "b": 3,
      "class": "Roman",
      "length": 30.0,
      "crossing_id": 1
    },
    {
      "id": 3,
      "a": 2,
      "b": 4,
      "class": "Road",
      "length": 18.0,
      "crossing_id": null
    }
  ],
  "cities": [
    {
      "id": 101,
      "x": 10,
      "y": 20,
      "kingdom_id": 1,
      "is_capital": true,
      "production": {
        "food": 1.2,
        "wood": 0.8,
        "ore": 0.6
      }
    },
    {
      "id": 102,
      "x": 70,
      "y": 25,
      "kingdom_id": 2,
      "is_capital": true,
      "production": {
        "food": 1.0,
        "wood": 1.1,
        "ore": 0.7
      }
    }
  ],
  "villages": [
    {
      "id": 201,
      "x": 42,
      "y": 40,
      "city_id": 101,
      "road_node_id": 4,
      "production": {
        "food": 1.1,
        "wood": 0.9
      }
    }
  ],
  "crossings": [
    {
      "id": 1,
      "x": 55,
      "y": 24,
      "type": "bridge",
      "river_id": 1
    }
  ],
  "forts": [
    {
      "id": 301,
      "x": 53,
      "y": 24,
      "edge_id": 2,
      "crossing_id": 1,
      "pair_id": 302
    },
    {
      "id": 302,
      "x": 57,
      "y": 24,
      "edge_id": 2,
      "crossing_id": 1,
      "pair_id": 301
    }
  ],
  "kingdoms": [
    {
      "id": 1,
      "name": "Northdale",
      "capital_city_id": 101,
      "polygon": [
        [
          0,
          0
        ],
        [
          50,
          0
        ],
        [
          50,
          50
        ],
        [
          0,
          50
        ]
      ]
    },
    {
      "id": 2,
      "name": "Southreach",
      "capital_city_id": 102,
      "polygon": [
        [
          50,
          0
        ],
        [
          100,
          0
        ],
        [
          100,
          50
        ],
        [
          50,
          50
        ]
      ]
    }
  ],
  "rivers": [
    {
      "id": 1,
      "polyline": [
        [
          48,
          23
        ],
        [
          50,
          23
        ],
        [
          52,
          23
        ],
        [
          55,
          24
        ],
        [
          58,
          25
        ],
        [
          60,
          26
        ]
      ]
    }
  ],
  "climate_cells": [
    {
      "id": 1,
      "polygon": [
        [
          0,
          0
        ],
        [
          50,
          0
        ],
        [
          50,
          50
        ],
        [
          0,
          50
        ]
      ],
      "temp": 0.6,
      "moisture": 0.5,
      "biome_id": 3,
      "prod_mod": {
        "food": 0.1,
        "wood": 0.0,
        "ore": 0.0
      }
    },
    {
      "id": 2,
      "polygon": [
        [
          50,
          0
        ],
        [
          100,
          0
        ],
        [
          100,
          50
        ],
        [
          50,
          50
        ]
      ],
      "temp": 0.5,
      "moisture": 0.7,
      "biome_id": 4,
      "prod_mod": {
        "food": 0.05,
        "wood": 0.1,
        "ore": -0.05
      }
    }
  ]
}